"nom_commercial","raison_sociale","email","telephone","website","adresse","ville","region","pays","code_postal","secteur_activite","taille_entreprise","type_entreprise","nombre_employes","chiffre_affaires","description","siren","siret","code_naf","qualification_score","score_pct","statut","segment","enrich_score","criteria_met","criteria_total","source","email_valid","website_active","linkedin_url","created_at","sector_confidence"
"La pépite","La pépite","hello@pepite.paris","06 86 82 07 17","https://pepite.paris","40 Rue Laffitte","Paris","","France","","Informatique","","","","","Des séminaires, ateliers de cohésion d'équipe, teambuildings engagés : ateliers culinaires, dégustations, ateliers floraux, jeux, rallyes...","","","","70","70.0","QUALIFIE","","4","7","9","OpenStreetMap","True","True","https://www.linkedin.com/company/pepite-paris","2026-04-16T12:02:23.649544","1.0"
"MAC Store Green","MAC Store Green","macstoregreen@gmail.com","+33783543298","https://macstoregreen.fr/en","","Paris","","France","","Informatique","","","","","MAC STORE Green est votre boutique en ligne spécialisée dans la réparation et la vente de produits reconditionnés Apple. Trouvez les meilleurs prix sur les iPhone, MacBook et iPad reconditionnés.","","","","70","70.0","QUALIFIE","","3","7","9","OpenStreetMap","True","True","","2026-04-16T12:02:23.649544","1.0"
"Microsoft France","Microsoft France","ms-enterprise.fi@sktes.com","+33 1 57 75 10 00","http://www.microsoft.com/fr/fr","","Paris","","France","","Informatique","","","","","","","","","70","70.0","QUALIFIE","","3","7","9","OpenStreetMap","True","True","","2026-04-16T12:02:23.649544","1.0"
"Aerow SAS","Aerow SAS","contact@aerow.fr","01 42 25 29 31","http://www.aerow.fr","","Paris","","France","","Informatique","","","","","AEROW est un projet collectif aujourd’hui mené par des experts passionnés pour répondre aux enjeux de transformation digitale et gestion documentaire de nos clients. 
Aerow Group | Smart Contents","","","","70","70.0","QUALIFIE","","3","7","9","OpenStreetMap","True","True","","2026-04-16T12:02:23.649544","1.0"
"Easter-eggs","Easter-eggs","info@easter-eggs.com","+33 1 43 35 00 37","https://www.easter-eggs.com","44/46, rue de l'Ouest75014ParisFrance","Paris","","France","","Informatique","","","","","Créée en 1997, Easter-eggs est une des plus anciennes ENL (Entreprise du Numérique Libre). Spécialiste GNU/Linux, ses métiers couvrent tous les champs des ENL : installation, administration et sécurisation de systèmes, adaptation de logiciels sous environnement GNU/Linux, développements spécifiques, conseil, audit et formation.","","","","70","70.0","QUALIFIE","","3","7","9","OpenStreetMap","True","True","","2026-04-16T12:02:23.649544","1.0"
"/ut7","/ut7","paris@ut7.fr","09 72 44 75 46","http://ut7.fr","14 avenue Ledru-Rollin 75012 Paris - France","Paris","","France","","Informatique","","","","","/ut7 est une anthroprise expérimentale","","","","70","70.0","QUALIFIE","","3","7","9","OpenStreetMap","True","True","","2026-04-16T12:02:23.649544","1.0"
"Zenika","Zenika","mydata@zenika.com","+33 1 45 26 19 15","https://zenika.com","53 rue de Châteaudun","Paris","Île-de-France","France","75009","Informatique","","","","","Cabinet de Conseil en IT","","","","70","70.0","QUALIFIE","","4","7","9","OpenStreetMap","True","True","https://www.linkedin.com/company/zenika/?originalSubdomain=fr","2026-04-16T12:02:23.650545","1.0"
"Openska","Openska","contact@openska.com","01 42 62 91 86","https://www.openska.com","","Paris","","France","","Informatique","","","","","Openska est spécialiste de la formation (Tel : 01 84 25 05 10). Plus de 100 formations professionnelles avec une spécialisation Web, Data et DevOps","","","","70","70.0","QUALIFIE","","3","7","9","OpenStreetMap","True","True","","2026-04-16T12:02:23.650545","1.0"
"Mathworks","Mathworks","info@mathworks.fr","+33 1 41 14 87 00","http://www.mathworks.fr","","Paris","","France","","Informatique","","","","","","","","","70","70.0","QUALIFIE","","3","7","9","OpenStreetMap","True","True","","2026-04-16T12:02:23.650545","1.0"
"E.S.R.","E.S.R.","contacts@esr.fr","+33 1 47 65 14 00","http://www.esr.fr","","Paris","","France","","Informatique","","","","","","","","","70","70.0","QUALIFIE","","3","7","9","OpenStreetMap","True","True","","2026-04-16T12:02:23.650545","1.0"
"Openbridge","Openbridge","contact@openbridge.fr","+33 1 41 17 41 30","https://www.openbridge.fr","","Paris","","France","","Informatique","","","","","","","","","70","70.0","QUALIFIE","","3","7","9","OpenStreetMap","True","True","","2026-04-16T12:02:23.650545","1.0"
"Alten (Groupe)","Alten (Groupe)","privacy@kinsta.com","+33 1 46 08 72 00","https://www.alten.fr","ALTEN France Siège social 221 bis boulevard Jean Jaures 92100 Boulogne Billancourt 65 avenue Edouard Vaillant 92514 Boulogne-Billancourt Cedex","Paris","","France","","Informatique","","","","","ALTEN accompagne ses clients dans les domaines de l’innovation, de la R&D et des systèmes d’information en France comme dans le monde entier.","","","","70","70.0","QUALIFIE","","4","7","9","OpenStreetMap","True","True","https://fr.linkedin.com/company/alten","2026-04-16T12:02:23.650545","1.0"
"DL Santé","DL Santé","info@dlsante.fr","+33 1 46 11 03 00","http://www.dlsante.fr","","Paris","","France","","Informatique","","","","","","","","","70","70.0","QUALIFIE","","3","7","9","OpenStreetMap","True","True","","2026-04-16T12:02:23.650545","1.0"
"Artifica","Artifica","info@artifica.fr","01 40 09 77 12","https://www.artifica.fr","2 Rue du Repos","Paris","Île-de-France","France","75020","Informatique","","","","","Tél. 01 40 09 77 12 - Création sites web, plans interactifs.","","","","70","70.0","QUALIFIE","","4","7","9","OpenStreetMap","True","True","https://www.linkedin.com/company/artifica/","2026-04-16T12:02:23.650545","1.0"
"Excelcio","Excelcio","contact@excelcio.com","+33 1 71 19 45 00","https://excelcio.com","113 Rue Saint-Maur","Paris","Île-de-France","France","75011","Informatique","","","","","","","","","70","70.0","QUALIFIE","","3","7","9","OpenStreetMap","True","True","","2026-04-16T12:02:23.650545","1.0"
"Subskill","Subskill","contact@subskill.com","01 81 70 15 65","https://www.subskill.com","","Paris","","France","","Informatique","","","","","Subskill est une agence digitale experte en e-commerce, plateformes digitales, applications mobiles. L'agence accompagne les marques sur leurs projets de transformation digitale.","","","","70","70.0","QUALIFIE","","4","7","9","OpenStreetMap","True","True","https://www.linkedin.com/company/subskill/","2026-04-16T12:02:23.650545","1.0"
"Varcap Informatique","Varcap Informatique","contact@depannage-informatique-75019.paris","+33 6 51 50 72 52","https://depannage-informatique-75019.paris","21 Place de la République","Paris","Île-de-France","France","75003","Informatique","","","","","Varcap Informatique est une société de dépannage informatique PC et Mac, intervenant à domicile et en entreprise.","","","","70","70.0","QUALIFIE","","3","7","9","OpenStreetMap","True","True","","2026-04-16T12:02:23.651544","1.0"
"Probayes","Probayes","rgpd@probayes.com","+33 4 76 42 64 13","https://www.probayes.com","9 Rue du Colonel Pierre Avia","Paris","Île-de-France","France","75015","Informatique","","","","","Découvrez les solutions IA de Probayes : machine learning, NLP, vision par ordinateur et plus pour transformer vos données en valeur ajoutée","","","","70","70.0","QUALIFIE","","3","7","9","OpenStreetMap","True","True","","2026-04-16T12:02:23.651544","1.0"
"Nuxly","Nuxly","bonjourosm@nuxly.com","+33 1 88 32 06 20","https://www.nuxly.com","97 Rue de Montreuil","Paris","Île-de-France","France","75011","Informatique","TPE","","","","Nuxly est une société de conseil en technologies de l'information et de la communication pour PME, TPE et startup.","","","","70","70.0","QUALIFIE","","3","7","9","OpenStreetMap","True","True","","2026-04-16T12:02:23.651544","1.0"
"Capgemini","Capgemini","contact@capgemini.com","+33 1 47 54 50 00","https://www.capgemini.com","11 Rue de Tilsitt","Paris","","France","","Informatique","","","","","Siège Social","","","","70","70.0","QUALIFIE","","4","7","9","OpenStreetMap","True","True","https://www.linkedin.com/company/capgemini","2026-04-16T12:02:23.651544","1.0"
"BDD Computing","BDD Computing","support@bddcomputing.fr","06 18 30 30 30","https://bddcomputing.fr","","Paris","","France","","Informatique","","","","","BDD Computing : dépannage, maintenance, développement web, cybersécurité, récupération de données et formation pour particuliers et professionnels. Intervention Paris et Île-de-France.","","","","70","70.0","QUALIFIE","","3","7","9","OpenStreetMap","True","True","","2026-04-16T12:02:23.651544","1.0"
"fastmag","fastmag","contact@fastmag.fr","0857734500","https://www.fastmag.fr","","Paris","","France","","Informatique","","","","","ERP commerce mode, Fastmag centralise retail, ventes B2B, production et analyse pour piloter votre activité en temps réel.","","","","70","70.0","QUALIFIE","","3","7","9","OpenStreetMap","True","True","","2026-04-16T12:02:23.651544","1.0"
"Gandi","Gandi","direction@gandi.net","01 70 39 37 45","https://www.gandi.net","","Paris","","France","","Informatique","","","","","➤ Gérez votre site web, vos emails, vos certificats SSL et vos serveurs VPS. ✅ Inclus avec un nom de domaine : 1 certificat SSL offert, Alias et redirections illimités et notre serveur de nom LiveDNS.","","","","70","70.0","QUALIFIE","","4","7","9","OpenStreetMap","True","True","https://www.linkedin.com/company/gandi/","2026-04-16T12:02:23.651544","1.0"
"Chronodisk","Chronodisk","contact@chronodisk.com","01 40 60 00 00","https://www.chronodisk-recuperation-de-donnees.fr","","Paris","","France","","Informatique","","","","","Chronodisk, Récupération de données Disques Durs / Ssd Téléphones serveurs Raid / Nas clés Usb cartes Sd. Devis / Enlèvement gratuits, Paris 15e.","","","","70","70.0","QUALIFIE","","3","7","9","OpenStreetMap","True","True","","2026-04-16T12:02:23.651544","1.0"
"24ème","24ème","contact@24eme.fr","01 94 25 84 01","https://www.24eme.fr","182 Boulevard de la Villette","Paris","Île-de-France","France","75019","Informatique","","","","","Conception et développement de logiciels libres adaptés aux métiers de nos clients","","","","70","70.0","QUALIFIE","","4","7","9","OpenStreetMap","True","True","https://www.linkedin.com/company/9437998","2026-04-16T12:02:23.651544","1.0"
"Threekit","Threekit","contact@threekit.com","+33 6 15 37 15 79","https://www.threekit.com/fr","91 Rue du Faubourg Saint-Honoré","Paris","Île-de-France","France","75008","Informatique","","","","","Le configurateur vous permet de visualiser des produits en 2D photoréaliste, en 3D et en réalité augmentée, le tout à partir d'une seule plateforme.","","","","70","70.0","QUALIFIE","","3","7","9","OpenStreetMap","True","True","","2026-04-16T12:02:23.651544","1.0"
"AlloMarcel","AlloMarcel","contact@allomarcel.com","09 50 59 56 56","https://allomarcel.com","","Paris","","France","","Informatique","","","","","AlloMarcel a sélectionné pour vous les meilleurs artisans de quartiers, qualifiés et honnêtes,
    pour tous vos travaux, petits et gros !","","","","70","70.0","QUALIFIE","","4","7","9","OpenStreetMap","True","True","https://www.linkedin.com/company/allomarcel-com?trk=company_logo","2026-04-16T12:02:23.652544","1.0"
"Yichnal","Yichnal","stephane@yichnal.fr","+33 7 67 61 21 51","https://www.yichnal.fr","1 Avenue de la Porte Brancion","Paris","Île-de-France","France","75015","Informatique","","","","","Yichnal est votre allié de proximité dans le secteur de la formation et des services informatiques. Nous vous proposons : site internet (hébergement gratuit), sécurité, protection de la vie privée, formations (jeunes & adultes) et cours de photographie.","","","","70","70.0","QUALIFIE","","3","7","9","OpenStreetMap","True","True","","2026-04-16T12:02:23.652544","1.0"
"Salesforce","Salesforce","info@jp.salesforce.com","+212520312220","https://www.salesforce.com/fr/company/locations","","Paris","","France","","Informatique","","","","","Salesforce est présent dans le monde entier. Retrouvez nos bureaux à travers le monde et découvrez comment nous transformons l'IA et les CRM dans votre pays.","","","","70","70.0","QUALIFIE","","3","7","9","OpenStreetMap","True","True","","2026-04-16T12:02:23.652544","1.0"
"ipéfix","ipéfix","contact@ipefix.net","01 77 48 88 00","https://www.ipefix.net","4 Rue Severo 75014 Paris","Paris","","France","","Informatique","","","","","En sa qualité d’opérateur Réseaux & Télécoms, IPEFIX propose aux hôteliers des solutions Fibre, Wifi, Chromecast et Téléphonie IP performantes, fiables et sécurisées.","","","","70","70.0","QUALIFIE","","4","7","9","OpenStreetMap","True","True","https://www.linkedin.com/company/ipefix/about/","2026-04-16T12:02:23.652544","1.0"
"Digitad","Digitad","nathan@integral.eu","+33 7 70 74 33 00","https://digitad.fr","Rue Bréguet","Paris","Île-de-France","France","75011","Informatique","","","","","Intégral, agence marketing digital Paris certifiée. SEO, GEO, Google Ads, Social Ads, IA. +200 clients et des résultats mesurables. Devis gratuit.","","","","70","70.0","QUALIFIE","","4","7","9","OpenStreetMap","True","True","https://www.linkedin.com/company/int%C3%A9gral-europe/","2026-04-16T12:02:23.652544","1.0"
"Synacktiv","Synacktiv","contact@synacktiv.com","+33 1 45 79 74 75","https://synacktiv.com","5 Boulevard Montmartre","Paris","Île-de-France","France","75002","Informatique","","","","","","","","","70","70.0","QUALIFIE","","3","7","9","OpenStreetMap","True","True","","2026-04-16T12:02:23.652544","1.0"
"Auzou éditions","Auzou éditions","lequipe@auzou.com","01 40 33 84 00","https://www.auzou.fr","","Paris","","France","","Informatique","","","","","Les Éditions Auzou, maison indépendante dédiée cultive l’imagination des enfants grâce à des livres, romans, bd, des jeux, et de nombreux loisirs créatifs.","","","","70","70.0","QUALIFIE","","3","7","9","OpenStreetMap","True","True","","2026-04-16T12:02:23.652544","1.0"
"Tastycloud","Tastycloud","contact@tastycloud.fr","06 30 47 63 17","https://www.tastycloud.fr","","Paris","","France","","Informatique","","","","","La solution n°1 de menus digitalisés en France : Click & Collect, menus QR code ou sur tablette tactile... Déjà utilisé par plus de 1000 restaurateurs !","","","","70","70.0","QUALIFIE","","4","7","9","OpenStreetMap","True","True","https://www.linkedin.com/company/tastycloud/?originalSubdomain=fr","2026-04-16T12:02:23.652544","1.0"
"Zyteck","Zyteck","contact@zyteck.fr","01 53 04 05 05","https://www.zyteck.fr","","Paris","","France","","Informatique","","","","","Zyteck spécialiste en informatique. Rapidité d'intervention, Proximité, Réactivité. Une équipe de techniciens diplômés, à votre écoute.","","","","70","70.0","QUALIFIE","","3","7","9","OpenStreetMap","True","True","","2026-04-16T12:02:23.653544","1.0"
"LOGICIELS HERTZIENS","LOGICIELS HERTZIENS","contact@mon-informaticien.com","03 88 95 33 55","https://www.mon-informaticien.com/entreprise/logiciels-hertziens-441069531-00040","9 RUE DU FAUBOURG SAINT-HONORE 75008 PARIS","Paris","Île-de-France","France","75008","Informatique","","","","","Faites appel à l'entreprise d'informatique LOGICIELS HERTZIENS (SARL) située à Paris-8 (75008). Cet informaticien est notamment spécialisé en Prestations informatiques.","441069531","44106953100040","62.02A","70","70.0","QUALIFIE","","3","7","9","data.gouv.fr/Sirene","True","True","","2026-04-16T12:02:22.274626","1.0"
"Sébastien Bourgine","Sébastien Bourgine","contact@sebastienbourgine.com","","https://www.sebastienbourgine.com","88 Avenue Simón Bolívar","Paris","","France","","Informatique","","","","","Webdesign services","","","","60","60.0","QUALIFIE","","2","6","9","OpenStreetMap","True","True","","2026-04-16T12:02:23.649544","1.0"
"Quadra Informatique","Quadra Informatique","","+33 1 53 45 99 00","https://www.quadra-informatique.fr","","Paris","","France","","Informatique","","","","","","","","","60","60.0","QUALIFIE","","2","6","9","OpenStreetMap","False","True","","2026-04-16T12:02:23.650545","1.0"
"Le Cargo","Le Cargo","","07 53 00 57 05","http://www.lecargo.paris","","Paris","","France","","Informatique","","","","","This domain may be for sale!","","","","60","60.0","QUALIFIE","","2","6","9","OpenStreetMap","False","True","","2026-04-16T12:02:23.650545","1.0"
"Métamicro","Métamicro","dpo@metamicro.com","","https://www.metamicro.com","","Paris","","France","","Informatique","","","","","Conception et édition de solutions logicielles métiers pour la gestion de processus financiers, juridiques et administratifs complexes (recouvrement, successions, ATD...)","","","","60","60.0","QUALIFIE","","3","6","9","OpenStreetMap","True","True","https://fr.linkedin.com/company/metamicro","2026-04-16T12:02:23.650545","1.0"
"Caoba Conseil","Caoba Conseil","contact@caoba.fr","","http://www.caoba.fr","23 Rue du Buisson Saint-Louis","Paris","Île-de-France","France","75010","Informatique","","","","","","","","","60","60.0","QUALIFIE","","2","6","9","OpenStreetMap","True","True","","2026-04-16T12:02:23.650545","1.0"
"Defensive Lab Agency","Defensive Lab Agency","contact@defensive-lab.agency","","https://defensive-lab.agency","","Paris","","France","","Informatique","","","","","Defensive Lab Agency is a French company founded in 2018 by [Esther Onfroy](https://esther.codes) with the objective of providing expert services on digital security and software development to non-governmental organizations and civil society.","","","","60","60.0","QUALIFIE","","2","6","9","OpenStreetMap","True","True","","2026-04-16T12:02:23.650545","1.0"
"WebFabrick","WebFabrick","contact@webfabrick.com","","https://www.webfabrick.com","","Paris","","France","","Informatique","","","","","WebFabrick develops your web solution to simplify the management of your various activities. Immediate benefits and features tailored to your needs. Get your free customized demo.!","","","","60","60.0","QUALIFIE","","3","6","9","OpenStreetMap","True","True","https://www.linkedin.com/company/webfabrick","2026-04-16T12:02:23.650545","1.0"
"None","None","contact@noemeparis.com","","https://noemeparis.com","","Paris","","France","","Informatique","","","","","Noème Paris, ""l'inaccessible"", est une Maison de haute parfumerie française. Découvrez nos fragrances exceptionnelles, une présentation unique et une invitation au voyage. Explorez l'univers du luxe et de la niche pour éveiller vos sens avec chaque parfum.","","","","60","60.0","QUALIFIE","","2","6","9","OpenStreetMap","True","True","","2026-04-16T12:02:23.651544","1.0"
"Deep Block","Deep Block","contact@deepblock.eu","","https://www.deepblock.eu","","Paris","","France","","Informatique","","","","","deepblock propose des services de signature électronique sécurisés et conformes à la réglementation eIDAS, incluant la génération rapide de certificats de signature qualifiée et des solutions de dépôt de créations. Notre plateforme utilise la blockchain pour garantir la sécurité des données et propose une API pour l'intégration de services SaaS. Hébergé en France, nous assurons une protection optimale des documents électroniques. Découvrez nos services pour sécuriser vos transactions numériques.","","","","60","60.0","QUALIFIE","","2","6","9","OpenStreetMap","True","True","","2026-04-16T12:02:23.651544","1.0"
"Contrôle-C","Contrôle-C","contact@ctrlc.fr","","https://ctrlc.fr","","Paris","","France","","Informatique","","","","","Contrôle-C est une agence de référence en France pour le SEO. Devenez NUMÉRO 1 sur GOOGLE et les moteurs de recherche via le RÉFÉRENCEMENT NATUREL PROFESSIONNEL","","","","60","60.0","QUALIFIE","","2","6","9","OpenStreetMap","True","True","","2026-04-16T12:02:23.651544","1.0"
"Scality","Scality","dpo@scality.com","","https://www.scality.com","","Paris","","France","","Informatique","","","","","Object storage solutions for enterprises to store, protect, and manage data across hybrid and multi-cloud environments.","","","","60","60.0","QUALIFIE","","3","6","9","OpenStreetMap","True","True","https://www.linkedin.com/company/scality","2026-04-16T12:02:23.651544","1.0"
"Alioscopy","Alioscopy","contact@alioscopy.com","","https://alioscopy.com","3 rue du Jourdain 75020 Paris FR","Paris","","France","","Informatique","","","","","Alioscopy est un pionnier des écrans 3D sans lunettes depuis 1987. Découvrez nos moniteurs autostéréoscopiques, l'Exobox holographique et Le Portail - un moniteur 3D 8K 65"" immersif avec tracking des yeux.","","","","60","60.0","QUALIFIE","","2","6","9","OpenStreetMap","True","True","","2026-04-16T12:02:23.651544","1.0"
"NeosLab","NeosLab","support@neoslab.com","","https://neoslab.com","","Paris","","France","","Informatique","","","","","Partner with a leading web agency for scalable, user-centered digital products. We blend design, tech, and strategy for global brands and startups.","","","","60","60.0","QUALIFIE","","3","6","9","OpenStreetMap","True","True","https://linkedin.com/company/neoslabx","2026-04-16T12:02:23.651544","1.0"
"comAvenue","comAvenue","info@comavenue.com","01 45 55 00 07","https://www.comavenue.com","","Paris","","France","","Informatique","","","","","","","","","60","60.0","QUALIFIE","","2","6","9","OpenStreetMap","False","True","","2026-04-16T12:02:23.651544","1.0"
"AXE E-Santé","AXE E-Santé","","09 53 87 78 72","https://www.axepartner.com","","Paris","","France","","Informatique","","","","","Le parcours digital du patient est le coeur de métier de Axe E Santé. Notre métier est centré sur les solutions digitales d'accueil patient et de gestion de files d'attente. Ces solutions digitales d'accueil patient sont dédiées aux cliniques, hopitaux, établissement de soins, aux problématiques d'accueil patient en cabinet de radiologie, gestion de flux patient en laboratoire, gestion de file d'attente en pharmacie et officines, la gestion de l'attente en cabinet d'ophtalmologie. Axe E Santé es","","","","60","60.0","QUALIFIE","","2","6","9","OpenStreetMap","False","True","","2026-04-16T12:02:23.651544","1.0"
"Reciproque","Reciproque","contact@reciproque.com","","http://www.reciproque.com","","Paris","","France","","Informatique","","","","","Reciproque conçoit des interfaces numériques d'accès à la culture pour les musées, les espaces d'exposition, les bibliothèques et les sites du patrimoine.","","","","60","60.0","QUALIFIE","","3","6","9","OpenStreetMap","True","True","https://fr.linkedin.com/company/reciproque","2026-04-16T12:02:23.651544","1.0"
"Indexima","Indexima","contact@indexima.com","","https://indexima.com","","Paris","","France","","Informatique","","","","","Indexima for snowflake is a new solution that automatically accelerates your BI and data viz queries by designing and creating automatically Dynamic Tables within your snowflake.","","","","60","60.0","QUALIFIE","","2","6","9","OpenStreetMap","True","True","","2026-04-16T12:02:23.651544","1.0"
"Innovela","Innovela","contact@innovela.com","","https://www.innovela.com","","Paris","","France","","Informatique","","","","","Innovela vous accompagne dans votre transformation numérique. Experts en Cloud, Data, IA, et développement d'applications sur mesure. Découvrez nos services.","","","","60","60.0","QUALIFIE","","3","6","9","OpenStreetMap","True","True","https://fr.linkedin.com/company/innovela","2026-04-16T12:02:23.652544","1.0"
"NBS System","NBS System","contact@nbs-system.com","","https://www.nbs-system.com","","Paris","","France","","Informatique","","","","","Appuyez-vous sur notre expertise en cybersécurité pour entreprise et anticipez les risques : Pentest, Audit, coaching security champion et plus.","","","","60","60.0","QUALIFIE","","3","6","9","OpenStreetMap","True","True","https://www.linkedin.com/company/nbs-system/","2026-04-16T12:02:23.652544","1.0"
"Worteks","Worteks","info@worteks.com","","https://www.worteks.com","","Paris","","France","","Informatique","","","","","Infrastructures complexes et hétérogènes  Cloud | Authentification | Sécurité  Plateformes collaboratives","","","","60","60.0","QUALIFIE","","3","6","9","OpenStreetMap","True","True","https://www.linkedin.com/company/worteks","2026-04-16T12:02:23.652544","1.0"
"Resix","Resix","contact@resix.com","","https://www.resix.com","","Paris","","France","","Informatique","","","","","Resix occupe depuis 20 ans une position de leader sur le marché des solutions télécoms ouvertes de voix sur IP, notamment avec la plateforme NetXServ…","","","","60","60.0","QUALIFIE","","2","6","9","OpenStreetMap","True","True","","2026-04-16T12:02:23.652544","1.0"
"Data-tricks","Data-tricks","contact@data-tricks.com","","https://www.data-tricks.com","","Paris","","France","","Informatique","","","","","","","","","60","60.0","QUALIFIE","","2","6","9","OpenStreetMap","True","True","","2026-04-16T12:02:23.652544","1.0"
"OCP INCUBATEUR LOGICIEL","OCP INCUBATEUR LOGICIEL","contact@bodacc.fr","01 83 64 31 00","https://www.bodacc.fr/pages/annonces-commerciales-detail/?q.id=id:A201100771047","","Paris","Île-de-France","France","75008","Éducation & Formation","","Société anonyme","","","Bulletin officiel des annonces civiles et commerciales","531528982","","","50","50.0","QUALIFIE","","3","6","9","BODACC","True","True","","2026-04-16T12:02:18.924134","0.337"
